{
  "outDir": "../services",
  "templatePath": "./pontTemplate",
  "transformPath": "./transform",
  "origins": [
    {
      "originUrl": "http://127.0.0.1:9099/api-docs.json",
      "name": "api1"
    },
    {
      "originUrl": "http://127.0.0.1:9099/api-docs.json",
      "name": "api2"
    }
  ]
}